Академия гражданской защиты МЧС России им. генерал-лейтенанта Д. И. Михайлика (АГЗ МЧС России);55.891857;37.347326;141435, Московская область, г. Химки, мкр. Новогорск, ул. Соколовская, стр. 1А ;8 (498) 699-05-59 ;agz@amchs.ru ;icon/uni/АГЗ.ico
Академия государственной противопожарной защиты МЧС России (АГПС МЧС России);55.825250;37.650734;г. Москва, ул. Бориса Галушкина,4 ;8 (495) 617-27-27 ;info@academygps.ru  ;icon/uni/АГПС.ico
Санкт-Петербургский университет ГПС МЧС России им. героя российской федерации генерала армии Е. Н. Зиничева ;59.875084;30.319254;196105, Санкт-Петербург, Московский проспект 149 ;8 (812) 388-86-39 ;ad@igps.ru ;icon/uni/СпбГПС.ico
Ивановская пожарно-спасательная академия ГПС МЧС России;56.964767;41.000709;153040, Ивановская область, г. Иваново, пр. Строителей, д. 33;8 (4932) 34-32-93;edufire@mail.ru ;icon/uni/ИваПСА.ico
Уральский институт ГПС МЧС России ;56.846803;60.648288;620062, Свердловская область, город Екатеринбург, улица Мира, дом 22 ;8 (343) 360-81-94;uigps@uigps.ru ;icon/uni/УраГПС.ico
Воронежский институт повышения квалификации сотрудников ГПС МЧС России ;51.629814;39.165768;394052, г. Воронеж, ул. Краснознаменная, д.231 ;8 (473) 277-86-53;mail@vipkgps.ru ;icon/uni/ВорГПС.ico
Сибирская пожарно-спасательная академия ГПС МЧС России;56.266939;93.544759;662972, Красноярский край, г. Железногорск, ул. Северная, 1 ;8 (3919) 73-54-05 ;info@sibpsa.ru ;icon/uni/СибПСА.ico
